id,timestamp,title,url,body_snippet,status,draft_payload
1,2026-03-01 15:42:46,"🏆 BOUNTY (1 SOL): Film ""Two AI Agents Talking Across Continents"" Mesh Demo",https://github.com/bolivian-peru/os-moda/issues/3,"## 🏆 Bounty: 1 SOL  **Film a real demo of two osModa servers communicating via encrypted P2P mesh. Upload to YouTube. Earn 1 SOL.**  ---  ## The Demo  **Title:** ""My Two AI Agents Talking to Each Other Across Continents""  **Format:** 60-90 seconds. Split-screen showing two terminals (two different servers). Real camera filming the screen.  **Hook (first 3 seconds):** ""I deployed two AI agents. They found each other automatically.""  ### What to show:  1. **Two servers:** Deploy two osModa instances (use `spawn.os.moda` or two VPS). Show they're in different locations (different IPs, ideally different regions). 2. **Mesh pairing:** On Server A, create a mesh invite (`mesh_invite_create`). Copy the invite code. On Server B, accept it (`mesh_invite_accept`). 3. **Connection:** Show `mesh_peers",REJECTED,
2,2026-03-01 15:42:46,[Bounty] Post RustChain to a Subreddit - 2 RTC,https://github.com/Scottcjn/rustchain-bounties/issues/514,"## Bounty: Reddit Post **Reward**: 2 RTC | **Difficulty**: Easy | **Time**: ~10 minutes | **Multi-claim**: Yes  ### What to do Post about RustChain to a relevant subreddit (r/cryptocurrency, r/blockchain, r/retrocomputing, r/vintagecomputing, r/powerpc, etc.)  ### Acceptance criteria - [ ] Post follows subreddit rules - [ ] Contains repo link - [ ] Not spam/low-effort - [ ] Post link shared as comment here  ### How to claim Post link as comment. 2 RTC per unique subreddit post.  **Reward**: 2 RTC (~$0.20) | **Multi-claim**",REJECTED,
3,2026-03-01 15:42:46,[Bounty] Write a Tweet Thread About RustChain - 2 RTC,https://github.com/Scottcjn/rustchain-bounties/issues/513,"## Bounty: Tweet Thread (3+ tweets) **Reward**: 2 RTC | **Difficulty**: Easy | **Time**: ~15 minutes | **Multi-claim**: Yes  ### What to do Write a tweet thread (3+ tweets) explaining RustChain, Proof-of-Antiquity, or the vintage hardware mining concept.  ### Acceptance criteria - [ ] Thread has 3+ tweets - [ ] Technically accurate - [ ] Link to repo included - [ ] Thread link posted as comment here  ### How to claim Post thread link as a comment. 2 RTC per unique thread.  **Reward**: 2 RTC (~$0.20) | **Multi-claim**",REJECTED,
4,2026-03-01 15:42:46,[BOUNTY] Cross-Repo Star & Engage Multiplier (Pool: 300 RTC),https://github.com/Scottcjn/rustchain-bounties/issues/477,"## Cross-Repo Star & Engage Bounty  **Pool: 300 RTC** | **Per-person max: ~50 RTC**  Star our lesser-known repos and leave a meaningful comment on an issue — the more repos you engage with, the higher your per-star payout.  ### Multiplier Tiers  | Repos Starred | RTC Per Star | Bonus | |---------------|-------------|-------| | 1-2 repos | 1 RTC | Base | | 3-4 repos | 1.5 RTC each | +50% | | 5-9 repos | 2 RTC each | +100% | | 10+ repos | 2.5 RTC each | +150% |  ### Comment Bonus  Leave a **meaningful comment** (not just ""starred!"") on any open issue in a repo you starred: **+0.5 RTC per repo**.  Examples of meaningful comments: - Ask a question about how something works - Suggest a feature or improvement - Report a bug you found - Share how you'd use the project  ### Qualifying Repos (under",REJECTED,
5,2026-03-01 15:42:46,[BOUNTY] Attestation Fuzz Harness + Crash Regression Corpus (98 RTC),https://github.com/Scottcjn/rustchain-bounties/issues/475,"## Bounty: Attestation Fuzz Harness + Crash Regression Corpus  **Reward:** 98 RTC (reduced 25%) **Category:** API hardening / red-team  ## Objective Create a fuzz/property-based test harness for attestation ingestion and validation, with a reusable regression corpus for known and newly discovered crash classes.  ## Why this matters Attestation parsing is externally exposed and high-risk. We need to prevent unhandled exceptions, parser edge-case bypasses, and DoS-class malformed payloads.  ## Scope - Target attestation-related request parsing/validation paths. - Generate malformed and adversarial payloads (type confusion, missing fields, nested structures, oversized values, boundary timestamps, boolean/dict shape mismatch, etc.). - Capture and persist crashing/minimizing inputs into a regre",DRAFT_REQUESTED,

